id,Company,Title,Location,Responsibilities,Minimum Qualifications,Preferred Qualifications
138,Google,"Partner Business Manager (DACH), System Integrator Partnerships (German)","Frankfurt, Germany","Define customer-centric and industry-specific use cases. Build ecosystem of service partners for Google’s cloud infrastructure offerings and Google SaaS offerings.
Establish partner performance criteria and drive partners to support Google business through staff training and certification on Google Cloud and G Suite products. Develop Google reference architectures and solutions.
Help partners grow their practice and product portfolio through joint development of solutions and services. Develop and provide custom presentations on Google Cloud Platform technologies to partners to help them achieve strategic goals.
Advocate for Google’s strategy in key industry events.
Develop Google’s approach to partnership strategy with stakeholders in Partner Programs, Product Management, Engineering, Sales and Marketing. Support regional engagement with global and regional partners.","BA/BS degree or equivalent practical experience.
Experience with building scalable partner ecosystems ranging from agile partners, mid-tier integrators and global system integrators.
Experience working with products in Infrastructure as a Service (IaaS) or Platform as a Service (PaaS).
Ability to speak and write English and German fluently and idiomatically.","MBA degree.
Industry knowledge of System Integrators (SIs)/Service Providers (SPs) and Independent Software Vendors (ISVs). Knowledge of Cloud ecosystem.
Understanding of foundational cloud technologies (network, compute, database, middleware, visualization, etc).
Partner/channel pipeline development and people management skills.
Demonstrated interpersonal skills when working in a cross-functional organization.
Excellent written and oral communication skills."
139,Google,"Account Manager, Media Buying Solutions","Dublin, Ireland","Project manage ‘virtual’ AM teams and promote best-practice sharing and alignment between markets.
Develop strategic account plans for customers and identify growth opportunities.
Represent team activities in EMEA/Global meetings (internal and/or external) and update stakeholders on the status of projects.
Create relationships within customer organisations at all levels including senior executives, direct/indirect users of the product and decision makers.
Be the primary point of contact for customers around all key areas (training, product enhancement, global/regional campaigns) and lead cross-functional efforts to identify and solve business challenges.","BA/BS degree or equivalent practical experience.
Experience in online, software sales, or online marketing.
Experience in the use of programmatic ad buying tools.","Experience in the ad tech market in a sales role or as a user. Experience in the use of programmatic ad buying tools.
Demonstrated strategic and analytical sales approach with a record of building strong and lasting customer relationships.
Well-organized, analytical and capable of handling multiple ad hoc requests simultaneously.
Effective organizational, analytical, influencing and presentation skills."
140,Google,"Account Strategist, Global Partnerships Sales Engine","San Francisco, CA, United States","Turn ambiguous data reporting and optimization needs into automated or scalable solution to drive operational efficiency, and reduce manual effort by GPSE.
Contribute proactively to the analysis and optimization of processes, internal tools and product to drive efficiency and scale.
Share findings, methodologies and timelines with a diverse, cross-functional audience to validate the work and ensure business needs are met.
Design and lead work streams to deploy refined workflows, tools or processes to all affected teams (e.g. our team, end users, cross-functional partners) with high impact and operational efficiency gains.
Establish and lead Subject Matter Expertise (SME) with extensive cross-functional stakeholder management and deep engagement.","3 years of work experience with project management, ad operations or technical account management.
Experience working in SQL, JavaScript, HTML or Apps Scripts to standardize ambiguous workflows.
Product and project management experience.","Experience using one monetization and/ or ad serving solution (DoubleClick AdExchange, AdSense, DoubleClick for Publishers, or other solutions).
Proven track record of managing multiple projects, consistently meeting deadlines and delivering high-impact results.
Broad understanding of online advertising (i.e. ad serving, monetization solutions) and of key platforms and trends (i.e. desktop, mobile, video).
Ability to build strong relationships and work effectively cross-functionally.
Self-motivated and comfortable operating in a rapidly changing and largely undefined industry.
Extremely proactive, organized, responsible, and proven ability to work well with a team."
141,Google,"Mobile Web Specialist, LCS Central Europe (German)","Berlin, Germany","Work with Google’s largest customers on projects that help them improve their mobile websites - in order to offer their users a better experience and increase their mobile ROI
Consult our advertisers on how to make their mobile sites load faster and improve the User Experience (UX) using tools like Lighthouse, WebPageTest and Google’s UX and speed research findings. Help our advertisers understand how Next Generation mobile web technologies from Google can improve their mobile site - from Accelerated Mobile Pages (AMP) to Progressive Web Apps (PWA) to our Payments and Identity APIs etc.
Partner with Google's tech support teams to leverage technical support for our most advanced advertisers. Successfully manage these cross-functional projects to speed up the implementation progress and increase the success rate.
Develop relations with both regional and global product management teams at Google to roll out best-in-class products to your country. Collate advertiser feedback in order to further improve our products.
Organize mobile site events, incl. hackathons and workshops. Train advertisers and agencies on mobile site speed, UX and technologies; develop case studies of successful projects for publication on our Think with Google site and at events to scale best practices to the wider industry.","Bachelor's degree or equivalent practical experience.
Experience with mobile marketing and mobile websites.
Experience in consultative sales, with client-facing experience.
Ability to speak and write in German and English fluently and idiomatically.","Extensive experience working with large clients and partners across different levels and cross-functional stakeholders.
Experience with diagnosing and improving mobile website load speed. Experience giving UX advice and proposing a/b testing plans.
Experience with Next Generation mobile web technologies like Accelerated Mobile Pages (AMP), Progressive Web Apps (PWA), Payments APIs, Identity APIs, https and interest in the next wave of digital touchpoints (Voice, Google Assistant).
Understanding of mobile web development (HTML, CSS and JavaScript experience).
Demonstrated ability to influence in regards to mobile and to drive tangible impact for large corporate organizations.
Passion for a faster and better mobile Web."
142,Google,GMS Sales Agency Lead,"New York, NY, United States","Manage and strengthen executive-level agency relations through key meetings, business reviews and speaking engagements. Deliver business growth, engagement and client satisfaction for a portfolio of GMS-managed agencies in an assigned market.
Recruit, retain and lead the team of GMS Sales Development Managers and Account Strategists, to ensure improved same-store-growth, high agency satisfaction and enhanced portfolio health.
Coach a team and help them engage with stakeholders in GMS agencies. Build and actively manage effective long-term agency planning process.
Define the future of agency management and help to develop the necessary infrastructure and processes. Initiate and run strategic initiatives to further develop new and existing GMS agency business.
Work closely with other agency leads and the new business sales teams to align on Objectives and Key Results (OKRs). Partner with New Business Sales teams to define a list of potential prospects, including both new and existing accounts.","BA/BS degree or equivalent practical experience.
6 years of experience in sales delivery/client engagement, operations and partner management.","MBA degree or equivalent practical experience.
Experience in building relationships with internal and external stakeholders.
Effective people management skills.
Ability to travel up to 20% of the time."
143,Google,"Field Sales Representative, Google Cloud (DACH)","Berlin, Germany","Engage with prospect organizations to position Google Cloud Platform solutions through strategic value based solution proposals, references and analyst data.
Work with wider Google AdWords and Google Cloud account teams to develop and drive pipeline, and provide guidance. Work with Google Cloud Platform partners to develop campaigns.
Serve as the primary customer contact during bid submission, pilot test, legal review and procurement. Keep records of customer interactions and provide quarterly projections.
Build a pipeline of customers within selected verticals.
Leverage Google Sales Engineering and marketing resources, and provide input on current collateral materials and ideas on how to improve them.","BA/BS degree in a technical or engineering field or equivalent practical experience.
Experience in direct client sales/management.
Sales and relationship management experience with a technology or infrastructure-as-a-service platform.
Ability to speak and write in English and German fluently and idiomatically.","Experience building and cultivating lasting relationships with accounts.
Understanding of Big Data landscape and Business Intelligence technologies, as well as knowledge of how various cloud technologies (PaaS and IaaS) work together to drive deeper technology adoption within the existing large account base.
Demonstrated ability to meet and exceed strategic goals in a fast-paced environment.
Ability to engage with both developer audiences as well as C-level IT and business leaders."
144,Google,"Associate Account Strategist (Russian), Global Customer Experience","Wrocław, Poland","Communicate with customers proactively, via phone and email.
Provide strategic advice and help customers by working closely with them in a consultative role.
Implement creative ways to improve our customer relationships. Tailor and share online marketing strategy suggestions, and promote other Google products.
Deliver against strategic goals consistently, while prioritizing and delivering an outstanding customer sales experience to Google's advertisers.","BA/BS degree or equivalent practical experience.
Ability to speak and write in English and Russian fluently and idiomatically.","Experience or internship experience in sales, customer service, account management, marketing or consulting.
Ability to multi-task and manage multiple projects at a time while paying strict attention to detail.
Experience in leading, motivating and working well with others. Demonstrated bias toward teamwork and collaboration.
Demonstrated experience in managing and customizing experience to a customer base.
Proactive, independent worker who is highly organized and interested in the difference they can make through their individual contribution.
Interest in working toward strategic goals."
145,Google,"Associate Account Strategist, Global Customer Experience (Ukrainian)","Dublin, Ireland","Communicate with customers proactively, via phone and email.
Provide strategic advice and help customers by working closely with them in a consultative role.
Implement creative ways to improve our customer relationships. Tailor and share online marketing strategy suggestions, and promote other Google products.
Deliver against strategic goals consistently, while prioritizing and delivering an outstanding customer experience for Google's advertisers.","BA/BS degree or equivalent practical experience.
Work experience in a graduate or Intern role.
Ability to speak and write in English and Ukrainian fluently and idiomatically.","Experience or internship experience in sales, customer service, account management, marketing or consulting.
Experience in leading, motivating and working well with others. Demonstrated bias toward teamwork and collaboration.
Demonstrated record in managing and customizing experience to a customer base.
Interest in working toward strategic goals.
Proactive, independent worker who is highly organized and interested in the difference they can make through their individual contribution.
Ability to multi-task and to manage multiple projects at a time while paying strict attention to detail."
146,Google,"Account Manager, Automotive (Japanese, English)","Tokyo, Japan","Establish relationships with key client decision-makers including C-level executives.
Manage key initiatives for your vertical industry team and work cross-functionally on product and opportunity development.
Build and maintain relationships with a list of dedicated clients, providing ongoing strategic consultation and support.","BA/BS degree or equivalent practical experience.
Experience working in the digital advertising industry.
Experience in sales and sales management.
Ability to speak and write in English and Japanese fluently and idiomatically.","4 years of experience in sales, customer support, account management (direct and/or offline), marketing (product, direct and/or offline), marketing program management, or consulting.
Proven ability to manage multiple projects at a time while paying strict attention to detail."
147,Google,"Deal Manager, Google Cloud","Washington, DC, United States","Partner with Field Sales teams early in the sales cycle to manage proposal development and shape strategic agreements.
Engage directly with business customers to lead commercial and agreement discussions; independently handle objections, socialize customer requests with internal stakeholders and coordinate approvals.
Serve as the Commercial Operations business partner to Regional Sales and Sales Operations Management, attending forecast calls, staff meetings and quarterly business reviews to keep apprised of priorities.
Build productive relationships and feedback loops with Legal, Finance, Sales and Product teams to accelerate agreement closure and drive continuous process improvement.","BA/BS degree in Technology, Engineering, Science or Economics or equivalent practical experience.
8 years of experience in leading agreement discussions, agreement management and/or executive selling within a technology company.
Experience in a Project Management role, developing agreements and financial modeling.
Ability to travel up to 50% of the time.","MBA, Master's, JD or other advanced degree.
Experience developing complex agreement structures and using presentation software to facilitate communication with internal and external stakeholders.
Knowledge of commercial Customer Relationship Manager (CRM) and Enterprise Resource Planning (ERP) systems.
Ability to lead and handle multiple time-sensitive projects.
Effective analytical and problem solving capabilities, with business judgement and the ability to present analysis in a clear and compelling manner."
148,Google,"Account Strategist, Global Partnerships Sales Engine","New York, NY, United States","Turn ambiguous data reporting and optimization needs into automated or scalable solution to drive operational efficiency, and reduce manual effort by GPSE.
Contribute proactively to the analysis and optimization of processes, internal tools and product to drive efficiency and scale.
Share findings, methodologies and timelines with a diverse, cross-functional audience to validate the work and ensure business needs are met.
Design and lead work streams to deploy refined workflows, tools or processes to all affected teams (e.g. our team, end users, cross-functional partners) with high impact and operational efficiency gains.
Establish and lead Subject Matter Expertise (SME) with extensive cross-functional stakeholder management and deep engagement.","3 years of work experience with project management, ad operations or technical account management.
Experience working in SQL, JavaScript, HTML or Apps Scripts to standardize ambiguous workflows.
Product and project management experience.","Experience using one monetization and/ or ad serving solution (DoubleClick AdExchange, AdSense, DoubleClick for Publishers, or other solutions).
Proven track record of managing multiple projects, consistently meeting deadlines and delivering high-impact results.
Broad understanding of online advertising (i.e. ad serving, monetization solutions) and of key platforms and trends (i.e. desktop, mobile, video).
Ability to build strong relationships and work effectively cross-functionally.
Self-motivated and comfortable operating in a rapidly changing and largely undefined industry.
Extremely proactive, organized, responsible, and proven ability to work well with a team."
149,Google,Online Sales Account Manager (Czech or Slovak),"Dublin, Ireland","Develop forward thinking, data-driven analysis and recommendations that align with client goals and quantify high-impact opportunities with clear recommendations to promote to clients.
Manage and build client relationships, manage implementation of advertising projects with clients and performance towards business goals.
Provide campaign updates and ensure that our advertisers are satisfied with their business growth.","BA/BS degree or equivalent practical experience.
Experience working in an analytical capacity in management consulting or similar role.
Ability to speak and write in English and Czech or Slovak fluently and idiomatically.","Ability to analyze complex advertiser performance data through tools such as Google AdWords and Google Analytics.
Thought leadership and ability to work towards strategic goals proactivity and the desire to put clients' needs first.
Excellent attention to detail and organizational skills.
Excellent interpersonal skills and the ability to work effectively cross-functionally and influence teams through expertise."
150,Google,"Account Executive (Direct), United Kingdom/Ireland","Dublin, Ireland","Establish credibility and develop partnerships with client executives from C-Level to board level and serve as a trusted consultant to maximize and expand their advertising investment.
Unlock agreements through deep client and industry understanding and working towards longer-term and an outstanding customer experience to Google's advertisers.
Set the vision and the strategy for how their advertising can reach the right consumer to achieve their goals and generate business plans to define strategies and tactics for success.
Own and lead a portfolio of businesses by understanding growth drivers, identifying opportunities for growth, managing risks and lead your portfolio to exceed metrics.
Be a multi-platform expert and trusted advisor to our largest advertisers, helping them adopt and get the most out of all Google platforms, including AdWords, DoubleClick, YouTube, Google Analytics, Google Cloud etc.","Bachelor's degree or equivalent practical experience.
Experience in direct or agency client advertising sales, marketing, consulting, media.
Experience selling to clients and influencing C-level stakeholders.","Experience managing and building a pipeline to support long-term sales growth.
Proven track record of sales experience with wins to demonstrate sales leadership.
Strong knowledge of the digital marketing ecosystem and successful marketing strategies for a range of different client industries.
Product knowledge across all digital advertising products areas.
Ability to leverage your business acumen to strategically assess and help solve client needs.
Knowledge of traditional and online marketing strategy and tactics."
151,Google,"Agency Lead, Traditional Media Agency, GMS","Ann Arbor, MI, United States","Manage executive-level agency and client relations through key C-level meetings, Agency Lead partnerships, and speaking engagements in market.
Deliver business growth, engagement and client satisfaction goals for a portfolio of GMS agency clients in your market.
Recruit, retain, coach, and lead a team of Account Strategists, Business/Agency Development Managers to ensure improved growth.
Build and manage effective long-term agency planning process. Partner with teams on quarterly plan development for key focus areas of brand, performance and productivity.","7 years of experience in sales delivery, client and agency engagement.
Experience working with advertisers, agencies, and/or clients. Experience in operations and partner management.
Experience building relationships with internal and external stakeholders.
Ability to travel to Canada up to 30% of the time.","MBA degree or equivalent practical experience.
Diverse cultural understanding and ability to work with global teams.
Effective analytical, problem-solving and people management skills.
Ability to speak and write in English fluently and idiomatically.
Interest in working towards an assigned quota and managing sustainable growth."
152,Google,"Growth Manager, US Gaming, Mobile Apps","Mountain View, CA, United States","Manage trusted relationships with clients and develop a thorough understanding of their business objectives, Key Performance Indicators (KPIs) and challenges.
Identify and pursue opportunities in your book of business, prioritize accounts, handle objections and evaluate campaign effectiveness.
Prospect and cultivate the app install business; Deliver consistently against assigned quotas.
Provide outstanding service to clients and troubleshoot advertiser issues.
Contribute to the development of Google’s comprehensive suite of app install ad products; Work and collaborate with a diverse set of mobile-focused cross-functional teams.","BA/BS degree or equivalent practical experience.
3 years of experience in an advertising sales or business development role.
Experience in the gaming industry.","Experience in a quantitative field such as, finance, economics, statistics, business analysis, or other equivalent.
Experience working in app developer industry.
Proven track record of exceeding sales goals; Interest in sales, marketing, media planning as well as an interest in working with and educating new advertisers.
Agile and creative problem solver who demonstrates grit and resolve to find solutions
Strong understanding of the app developer ecosystem.
Strong communication skills and the ability to pitch comprehensive advertising solutions."
153,Google,"Partner Business Manager (DACH), System Integrator Partnerships (German)","Berlin, Germany","Define customer-centric and industry-specific use cases. Build ecosystem of service partners for Google’s cloud infrastructure offerings and Google SaaS offerings.
Establish partner performance criteria and drive partners to support Google business through staff training and certification on Google Cloud and G Suite products. Develop Google reference architectures and solutions.
Help partners grow their practice and product portfolio through joint development of solutions and services. Develop and provide custom presentations on Google Cloud Platform technologies to partners to help them achieve strategic goals.
Advocate for Google’s strategy in key industry events.
Develop Google’s approach to partnership strategy with stakeholders in Partner Programs, Product Management, Engineering, Sales and Marketing. Support regional engagement with global and regional partners.","BA/BS degree or equivalent practical experience.
Experience with building scalable partner ecosystems ranging from agile partners, mid-tier integrators and global system integrators.
Experience working with products in Infrastructure as a Service (IaaS) or Platform as a Service (PaaS).
Ability to speak and write English and German fluently and idiomatically.","MBA degree.
Industry knowledge of System Integrators (SIs)/Service Providers (SPs) and Independent Software Vendors (ISVs). Knowledge of Cloud ecosystem.
Understanding of foundational cloud technologies (network, compute, database, middleware, visualization, etc).
Partner/channel pipeline development and people management skills.
Demonstrated interpersonal skills when working in a cross-functional organization.
Excellent written and oral communication skills."
