id,Company,Title,Location,Responsibilities,Minimum Qualifications,Preferred Qualifications
285,Google,"Partner Marketing Manager, Google Cloud","Chicago, IL, United States","Support development of the partner marketing strategy and program for Google Cloud.
Collaborate with the Partner Sales Manager(s) in assigned region/territory. Define a prioritized list of partners to jointly develop awareness and demand generation initiatives that promote Google Cloud.
Establish marketing strategy and plans, with partners, to drive demand and leads: Account mapping latices, eDM, Banner adverts, Syndicated Media, Webcasts, Events, Prospecting activities.
Manage lead flow with Google Sales Teams and Partner Sales--ensuring optimized process workflow into SFDC and reporting. Collaborate with America's Partner/Field Marketing team to ensure uniform process and content usage.
Lead flow management from Partner to Google Sales and from Google Sales to Partners. Interface with content and programs teams.","BA/BS degree or equivalent practical experience.
3 years of experience in partner marketing or field marketing and multi channel experience with enterprise software, developer, infrastructure or platform-as-a-service technologies
Experience building and implementing large-scale enterprise or channel events.
Experience working with online and reseller partners.","Computer Science or development experience.
Experience managing external creative agencies, events vendors, and international projects.
Experience in the business technology market and expertise in working closely with channel partners or partner organization to develop business.
Understanding of the enterprise software purchase, development and implementation cycles.
Strong project management skills.
Excellent quantitative reasoning, creativity and strategic skills."
286,Google,"Operations Manager, International and COO Communications, Google Cloud","Sunnyvale, CA, United States","Build new programs that can scale with the business.
Develop strategies and manage the day-to-day execution of corporate public relations activities.
Educate business press, analysts and other influencers about Google Cloud.
Manage ongoing executive communications opportunities including media briefings, speaking engagements, and other activities.","BA/BS degree or equivalent practical experience
6 years of relevant PR, media, or corporate communications experience.","Established media relationships and a solid understanding of cloud technologies.
Strong sense of accountability and ownership, combined with ability to delegate, motivate and develop team members.
Ability to deliver high quality work while managing multiple projects.
Strong research and analytical skills, with the ability to quickly identify trending topics and issues with a defined point of view.
Ability to engage with senior executives and leadership teams with excellent written and verbal communications skills.
Excellent editing and writing skills."
287,Google,Business Intern 2018,"Bucharest, Romania","Responsibilities and detailed projects will be determined based on your educational background, interest and skills.","Currently enrolled in a Bachelor's or Master's degree program and maintaining student status throughout the internship. Priority is given to students graduating end of 2018 or in 2019 so please include your graduation date on your resume.
Returning to education on a full-time basis upon completing the internship.
Ability to commit to a minimum of 10 weeks and up to 6 months at Google.","Previous internship experience in Sales, Advertising, Consulting, Analysis, Customer Service, Marketing or related fields."
288,Google,"Live Show Producer, Events and Experiences","San Francisco, CA, United States","Be responsible for bringing the event to life through on-screen content/graphic, video and live performance. Be responsible for talent management.
Support all aspects of technical and artistic production. Manage all show developments from inception to final wrap-up of the project.
Create a master production schedule and rehearsal schedule in conjunction with the project owner, and work with producers/project managers to develop budgets and timelines.
Serve as a liaison between external production agencies, internal content team and internal stakeholders.
Ensure everyone has a clear job description and is able to do their job effectively. Attend all production meetings and rehearsals, and provide support wherever needed.","BA/BS degree or equivalent professional experience.
6 years of experience in a similar role, producing live events/shows.","Experience in producing large scale live events.
Background in creative visual storytelling and experience with live show and video production, with a passionate for brands, stories, ideas, events, theatre, environments and live/physical design.
Experience either on the agency side producing large scale events or background in theatre production.
Strong leadership and executive presence and experience interfacing with and influencing senior leaders.
Ability to motivate and encourage others towards a common goal.
Self-motivated and articulate. Demonstrated and exceptional communication (both verbal and written), interpersonal and organizational skills."
289,Google,Business Intern 2018,"Wrocław, Poland","Responsibilities and detailed projects will be determined based on your educational background, interest and skills.","Currently enrolled in a Bachelor's or Master's degree program and maintaining student status throughout the internship. Priority is given to students graduating end of 2018 or in 2019 so please include your graduation date on your resume.
Returning to education on a full-time basis upon completing the internship.
Ability to commit to a minimum of 10 weeks and up to 6 months at Google.","Previous internship experience in Sales, Advertising, Consulting, Analysis, Customer Service, Marketing or related fields."
290,Google,"MBA Intern, Summer 2018","Sunnyvale, CA, United States",Google interns are given a lot of responsibility and the opportunity to give a meaningful contribution to their teams. Specific responsibilities are assigned to interns at the start of the program.,"Must be pursuing a full-time MBA program with an expected graduation date between December 2018 and June 2019.
Have authorization to work in the United States.
Be able to complete a 11-12 week program beginning in May or June 2018.","Interest in the technology industry and Google’s business.
Demonstrated critical thinking skills and independent motivation.
Excellent project management, interpersonal and organizational skills, with the ability to drive and implement ideas in a changing environment.
Analytical skills, and ability to solve highly strategic and difficult business problems."
291,Google,"Head of Field Marketing (North Asia), Google Cloud",Hong Kong,"Hire, lead and align the Regional Marketing and Product Marketing team with regional business goals.
Develop, socialize and cultivate buy-in in relation to regional marketing strategy and programs; work closely with Global Marketing and Regional Leadership teams, while representing the voice of the customer in the process.
Develop, implement, rollout and optimize customer acquisition campaigns and programs aligned to horizontal and vertical solutions including Google Cloud events, outbound campaigns, external trade shows and customer stories.
Develop campaigns to drive customer retention, business growth and product engagement, including customer conferences, seminars, education and other engagement tactics.
Cultivate awareness, familiarity and recognition for Google Cloud amongst analysts, influencers and other influencer organizations.","BA/BS degree or equivalent practical experience.
12 years of relevant experience in B2B marketing and/or field marketing.
Experience with enterprise software purchase, development and implementation cycles.","Experience in Computer Science or development.
Experience in project management; managing external creative agencies, events vendors and international projects.
Experience planning and executing multiple, complex marketing programs including budget management.
Knowledge of platforms such as Python, PHP, .NET, Java and cloud technologies.
Familiarity with marketing and web analytics, CRM systems (Salesforce or similar) and tracking tools to assess campaign effectiveness.
Ability to communicate technical concepts to technical and non-technical audiences. Ability to interact effectively with technical people and technologies."
292,Google,Business Intern 2018,"Prague, Czechia","Responsibilities and detailed projects will be determined based on your educational background, interest and skills.","Currently enrolled in a Bachelor's or Master's degree program and maintaining student status throughout the internship. Priority is given to students graduating end of 2018 or in 2019 so please include your graduation date on your resume.
Returning to education on a full-time basis upon completing the internship.
Ability to commit to a minimum of 10 weeks and up to 6 months at Google.","Previous internship experience in Sales, Advertising, Consulting, Analysis, Customer Service, Marketing or related fields."
293,Google,"Communications Manager, Ads and Commerce","New York, NY, United States","Work closely with business and product teams to develop compelling communications materials.
Devise press strategies, clear messaging and communications guidance related to our ads offerings for specific audiences.
Develop and maintain close, productive relationships with journalists, key partners and influencers in the advertising and trade press.
Train and coach company spokespeople for press engagements.","BA/BS degree or equivalent practical experience.
3 years of relevant PR experience working directly with journalists and members of the media.","Experience working for digital marketing companies.
Online advertising industry knowledge.
Demonstrated ability to work calmly and maintain good judgment in fast-paced environments.
Ability to think, plan and execute on multiple projects simultaneously in an organized fashion.
Ability to work cross-functionally with colleagues in different countries and understand cultural differences.
Proven communicator with excellent written and verbal communication skills."
294,Google,"Product Marketing Manager, IoT, Google Cloud Platform","Kirkland, WA, United States","Build inspiring technology showcase assets that excite customers and drive awareness of Google Cloud Platform in the market and engage with key influencers.
Create innovative marketing campaigns and technology showcases for Google Cloud Platform.
Partner with developer relations and engineering to develop industry leading product demonstrations for major events, including executive keynotes.
Serve as the internal advocate for our assigned products, achieving pipeline creation and go-to-market goals.
Identify, develop and/or manage the creation of a variety of content types (written, videos, presentations, etc.) as needed to develop sales and marketing success.","BA/BS degree in a technical or marketing field or equivalent practical experience.
7 years of technology or software marketing experience.","Experience in marketing with IoT or streaming analytics technology.
Experience in building creative assets and marketing content.
Experience in planning and actioning multiple, complex marketing programs including budget management.
Demonstrated ability as a product or technology advocate, with the ability to collaborate with engineering and marketing teams.
Excellent communication and organizational skills."
295,Google,Business Intern 2018,"Zagreb, Croatia","Responsibilities and detailed projects will be determined based on your educational background, interest and skills.","Currently enrolled in a Bachelor's or Master's degree program and maintaining student status throughout the internship. Priority is given to students graduating end of 2018 or in 2019 so please include your graduation date on your resume.
Returning to education on a full-time basis upon completing the internship.
Ability to commit to a minimum of 10 weeks and up to 6 months at Google.","Previous internship experience in Sales, Advertising, Consulting, Analysis, Customer Service, Marketing or related fields."
296,Google,"Merchandising Manager, Games, Google Play (English, Russian)","London, United Kingdom","Define country merchandising strategy for the games vertical in Russia and other key EMEA markets.
Manage strategy for editorial content and key partner co-promotion opportunities.
Develop user insights for the games vertical, including understanding of game lifecycles and in-game events and growth activities.
Analyze internal data, market research and industry trends to make content promotion and editorial decisions.
Align with global stakeholders to execute against local, regional and global plans.","BA/BS degree or equivalent practical experience.
Experience in a Merchandising, Marketing and/or Partnerships role for an online commerce or digital content business.
Experience working with the Russian gaming market.
Ability to speak and write in English and Russian fluently and idiomatically.","Experience working in function or company focused on mobile gaming.
Ability to analyze research or performance data and analyses to optimize merchandising strategy.
Ability to work with partners to develop co-promotion or cross-promotion strategies and campaigns.
Ability to advise on strategies and product requirements to enhance merchandising capabilities.
Effective analytical and communication skills, with a collaborative working approach."
297,Google,Business Intern 2018,"London, United Kingdom","Responsibilities and detailed projects will be determined based on your educational background, interest and skills.","Currently enrolled in a Bachelor's or Master's degree program and maintaining student status throughout the internship. Priority is given to students graduating end of 2018 or in 2019 so please include your graduation date on your resume.
Returning to education on a full-time basis upon completing the internship.
Ability to commit to a minimum of 10 weeks and up to 6 months at Google.","Previous internship experience in Sales, Advertising, Consulting, Analysis, Customer Service, Marketing or related fields."
298,Google,"Product Marketing Manager, Google Play, Japan (English, Japanese)","Tokyo, Japan","Spearhead the launch and growth of Google Play in Japan - building positioning messages, planning execution and overseeing the overall success of Google’s digital content business.
Drive engagements with key retailers, mobile operators, developers and OEM partners to promote Google Play.
Be the advocate of the Google and Google Play brands, educating and guiding our partners and team.
Be the voice of users in Japan within the Google and Google Play teams, showcasing the unique needs of this region and shepherding product development that can best serve the needs of users.","BA/BS degree or equivalent practical experience.
Ability to speak and write in English and Japanese fluently and idiomatically.","Understanding of Google's strategic, competitive position, search, online advertising, or web publishing markets.
Excellent problem solving and analytical skills with a high degree of analytical rigor.
Solid organizational skills with ability to manage and coordinate projects that span multiple locations.
Passion for mobile gaming.
Outstanding written and oral communication skills in Japanese and English."
299,Google,"BOLD Intern, Summer 2018","Ann Arbor, MI, United States",Google interns are given a lot of responsibility and the opportunity to provide a meaningful contribution to their teams. Specific responsibilities are assigned to interns at the start of the program.,"Be currently enrolled in a 4-year BA/BS program, in any major, at a university in the United States with an expected graduation date between December 2018 and June 2019.
Be able to complete an 11-week program beginning in May or June 2018.
Have authorization to work in the United States.","Analytical skills and an interest in taking on business problems.
Interpersonal and organizational skills, with the ability to navigate an ambiguous environment.
Interest in the technology industry and Google’s business."
300,Google,"Industry Public Relations Manager, Google Cloud","San Francisco, CA, United States","Build net new programs that can scale with the business.
Secure participation from customers and partners in a variety of PR activities ranging from media to events.
Develop strategies and manage the day-to-day execution of public relations in industry focused publications and events.
Educate business press, analysts and other influencers about Google Cloud.
Manage ongoing executive communications opportunities including media briefings, speaking engagements, and customer and partner activities.","BA/BS degree or equivalent practical experience
5 years of relevant PR, media, or corporate communications experience.","Established media relationships and a solid understanding of cloud technologies.
Strong sense of accountability and ownership, combined with ability to delegate, motivate and develop team members.
Ability to deliver high quality work while managing multiple projects.
Strong research and analytical skills, with the ability to quickly identify trending topics and issues with a defined point of view.
Ability to engage with senior executives and leadership teams with excellent written and verbal communications skills.
Strong, clear writing style and excellent editing skills."
301,Google,"Partner Public Relations Manager, Google Cloud","Sunnyvale, CA, United States","Build new programs that can scale with the business.
Secure participation from partners in a variety of PR activities ranging from media to events.
Develop strategies and own day-to-day execution of public relations related to Google Cloud partners.
Educate business press, analysts and other influencers about Google Cloud.
Manage ongoing executive communications opportunities including media briefings, speaking engagements, and customer and partner activities.","BA/BS degree or equivalent practical experience.
5 years of relevant PR, media, or corporate communications experience.","Established media relationships and a solid understanding of cloud technologies.
Strong sense of accountability and ownership, combined with ability to delegate, motivate and develop team members.
Ability to deliver high quality work while managing multiple projects.
Strong research and analytical skills, with the ability to quickly identify trending topics and issues with a defined point of view.
Ability to engage with senior executives and leadership teams with excellent written and verbal communications skills.
Strong, clear writing style and excellent editing skills."
302,Google,"Communications Manager, Developer and Emerging Ads","Mountain View, CA, United States","Work closely with business and product teams to develop compelling communications materials.
Devise press strategies, clear messaging and communications guidance related to our ads offerings for specific audiences.
Develop and maintain close, productive relationships with journalists, key partners and influencers in the advertising and trade press.
Train and coach company spokespeople for press engagements.","BA/BS degree or equivalent practical experience.
3 years of relevant experience in a PR role working directly with journalists and members of the media.","Experience working for digital marketing companies.
Knowledge of the online advertising industry.
Demonstrated ability to operate efficiently and maintain good judgment in fast-paced environments.
Ability to think, plan and execute on multiple projects simultaneously in an organized fashion.
Ability to work cross-functionally with colleagues in various countries and an understanding of cultural differences.
Effective written and verbal communication skills."
303,Google,"Product Marketing Manager, IoT, Google Cloud Platform","Seattle, WA, United States","Build inspiring technology showcase assets that excite customers and drive awareness of Google Cloud Platform in the market and engage with key influencers.
Create innovative marketing campaigns and technology showcases for Google Cloud Platform.
Partner with developer relations and engineering to develop industry leading product demonstrations for major events, including executive keynotes.
Serve as the internal advocate for our assigned products, achieving pipeline creation and go-to-market goals.
Identify, develop and/or manage the creation of a variety of content types (written, videos, presentations, etc.) as needed to develop sales and marketing success.","BA/BS degree in a technical or marketing field or equivalent practical experience.
7 years of technology or software marketing experience.","Experience in marketing with IoT or streaming analytics technology.
Experience in building creative assets and marketing content.
Experience in planning and actioning multiple, complex marketing programs including budget management.
Demonstrated ability as a product or technology advocate, with the ability to collaborate with engineering and marketing teams.
Excellent communication and organizational skills."
304,Google,"Product Manager, Growth, Waze","Tel Aviv-Yafo, Israel","Lead efforts of mapping user behavior, analyze performance and understand how to communicate with our users at the right way and the right time.
Create, maintain and execute an active roadmap of our efforts to retain users and increase usage.
Maintain direct communication with Waze company leads (Growth, Partnerships, Engineering, UI/UX, Marketing, Business Intelligence).
Provide thought leadership through implementing growth best practices, identifying and testing opportunities and developing new strategies to accelerate Waze user growth.
Lead an analytical approach to understand user insights and analyze Waze conversion funnel. Partner with research and analytics teams to identify growth initiatives, drive learnings and performance optimization to increase user acquisition, engagement and retention.","BA/BS degree or equivalent practical experience.
Experience working with product and data analytics.
Leadership, project management, relationship management and change management experience.","Experience managing results driven advertising campaigns for large, complex clients with proficiency in online measurement, operations, ad networks, DSPs, digital video and/or Google platforms.
Experience influencing stakeholders to implement recommendations
Knowledge of online products, user behavior and product analytics tool.
Demonstrated ability to structure analyses and draw data-driven insights."
305,Google,"Associate Product Marketing Manager Program (APMM), Japan Hardware Marketing","Tokyo, Japan","Conduct business analysis and other analytical activities to support Marketing strategy.
Drive and support strategic projects and initiatives.
Identify and develop key marketing operations processes to improve overall organizational efficiency and effectiveness.
Support executive communication within Marketing and to other cross-functional teams.
Work with external partners and coordinate on partnership/retail marketing.","BA/BS degree or equivalent practical experience.
1 year of work experience in marketing, consulting or related field.
Ability to speak and write in English and Japanese fluently and idiomatically.","Experience in management consulting, banking, or another role requiring rigorous analytical problem solving and quantitative analysis.
Demonstrated understanding of Google's products and the broader technology industry.
Demonstrated analytical success. Demonstrated capacity for developing and understanding strategy.
Penchant for technology, with demonstrated creativity and leadership skills to execute effectively. Ability to communicate findings to senior management.
Effective written and verbal communication skills, distinctive problem solving and analysis skills, and strong interpersonal skills, as well as impeccable business judgment."
306,Google,"Internal Communications Manager, Ads and Commerce","Mountain View, CA, United States","Develop, write, and edit communications for senior executives, including emails, Google+ posts, and presentations.
Develop creative strategies for communicating to employees: plan the frequency of and vehicles for communications, and coordinate across different areas of the business and the company.
Interact with, and influence executives, and provide advice that reflects an understanding of their business and leadership style.
Manage the end-to-end process for large company-wide events.
Provide strong communications and program management support for large internal reorganizations.","BA/BS degree or equivalent practical experience.
5 years of experience in media, government or non-profit environment, with a focus on writing and/or editorial responsibilities.","Graphic design abilities with excellent creative and visual skills, including slide design, with experience using Google Slides or other presentation software.
Demonstrated ability to work calmly and maintain good judgment in fast-paced, high-stress environments.
Effective team player who can lead efforts across disciplines.
Proven communicator - excellent written and verbal communications skills."
