id,Company,Title,Location,Responsibilities,Minimum Qualifications,Preferred Qualifications
463,Google,MBA Intern (Korean-English Bilingual) 2018,"Seoul, South Korea",Responsibilities vary by role.,"Must be pursuing a full-time MBA program with an expected graduation date between December 2018 and June 2019.
Be able to complete a minimum 10 week program at the Seoul office in 2018.
Ability to speak and write in English and Korean fluently and idiomatically.","3 years of relevant work experience in the areas of mobile apps and games, mobile business, distribution channels, and competitive landscape.
Demonstrated passion for mobile apps and games, mobile technology, and the broader mobile business.
Excellent analytical skills, with the ability to overcome strategic business challenges.
Excellent critical-thinking skills, with the ability to demonstrate and maintain self-motivation."
464,Google,"Product Analyst, Data Science","Kirkland, WA, United States","Conduct data analysis to make business recommendations (cost-benefit, invest-divest, forecasting, impact analysis).
Deliver effective presentations of findings and recommendations to multiple levels of stakeholders, creating visual displays of quantitative information.
Develop and automate reports, iteratively build and prototype dashboards to provide insights at scale, solving for analytical needs.
Collaborate with cross-functional stakeholders to understand their business needs, formulate and complete end-to-end analysis that includes data gathering, analysis, ongoing scaled deliverables and presentations.
Help Google to focus on key decisions to improve products and services.","BA/BS degree or equivalent practical experience.
3 years of experience working with statistical packages (e.g. R, SAS, Stata, MATLAB, etc.)
Experience with articulating product questions, pulling data from datasets (SQL) and using statistics to arrive at an answer.","BA/BS or Master's degree with emphasis on coursework of a quantitative nature (e.g., Statistics, Computer Science, Engineering, Mathematics, Data Sciences)
Experience in scripting with SQL, extracting large sets of data, and design of ETL flows
Work experience in an inter-disciplinary/cross-functional field.
Deep interest and aptitude in data, metrics, analysis and trends and applied knowledge of measurement, statistics and program evaluation.
Distinctive problem solving skills and impeccable business judgment.
Capable of translating analysis results into business recommendations. Strong written and verbal communication skills."
465,Google,"MBA Intern, Summer 2018","Ann Arbor, MI, United States",Google interns are given a lot of responsibility and the opportunity to give a meaningful contribution to their teams. Specific responsibilities are assigned to interns at the start of the program.,"Must be pursuing a full-time MBA program with an expected graduation date between December 2018 and June 2019.
Have authorization to work in the United States.
Be able to complete a 11-12 week program beginning in May or June 2018.","Interest in the technology industry and Google’s business.
Demonstrated critical thinking skills and independent motivation.
Excellent project management, interpersonal and organizational skills, with the ability to drive and implement ideas in a changing environment.
Analytical skills, and ability to solve highly strategic and difficult business problems."
466,Google,"MBA Intern, Summer 2018","New York, NY, United States",Google interns are given a lot of responsibility and the opportunity to give a meaningful contribution to their teams. Specific responsibilities are assigned to interns at the start of the program.,"Must be pursuing a full-time MBA program with an expected graduation date between December 2018 and June 2019.
Have authorization to work in the United States.
Be able to complete a 11-12 week program beginning in May or June 2018.","Interest in the technology industry and Google’s business.
Demonstrated critical thinking skills and independent motivation.
Excellent project management, interpersonal and organizational skills, with the ability to drive and implement ideas in a changing environment.
Analytical skills, and ability to solve highly strategic and difficult business problems."
467,Google,"MBA Intern, Summer 2018","Boulder, CO, United States",Google interns are given a lot of responsibility and the opportunity to give a meaningful contribution to their teams. Specific responsibilities are assigned to interns at the start of the program.,"Must be pursuing a full-time MBA program with an expected graduation date between December 2018 and June 2019.
Have authorization to work in the United States.
Be able to complete a 11-12 week program beginning in May or June 2018.","Interest in the technology industry and Google’s business.
Demonstrated critical thinking skills and independent motivation.
Excellent project management, interpersonal and organizational skills, with the ability to drive and implement ideas in a changing environment.
Analytical skills, and ability to solve highly strategic and difficult business problems."
468,Google,"Business Operations Lead, Google Play","Mountain View, CA, United States","Partner with stakeholders to develop business plans and ensure processes are adopted across regions. Help identify, structure and lead operational improvement initiatives.
Define how Google Play measures and tracks business growth, ensuring end-to-end visibility of metrics.
Perform quantitative analysis that translates data into actionable insights, and track and analyze product usage and team productivity metrics while establishing and implementing new reporting tools.
Drive continuous operational improvements for Google Play, including optimizing resource allocation across Product teams, measuring progress against business goals and facilitating weekly management meetings.
Collaborate with Product, Engineering, Google Technical Services Consumer, Legal, Finance, Compliance and other affiliated groups to drive product initiatives.","BA/BS degree or equivalent practical experience.
5 years of experience in management consulting, investment banking, corporate strategy and/or equivalent experience in a technology/media company.","Proficiency with SQL and Dremel, and familiarity with dashboard tools such as Duplos, Dasnav and/or Tableau.
Ability to pay attention to detail while handling multiple, simultaneous projects, with strong business acumen and the ability to navigate and influence personalities within a complex business environment.
Effective problem-solving and project management skills, and expertise implementing strategic and operational initiatives.
Excellent communication and facilitation skills."
469,Google,"Consumer Operations Product Support Manager, (Multiple Products)","Mountain View, CA, United States","Develop user support experience and strategy for both new and existing products, leading cross functional teams to execute against recommended plans.
Identify, drive, and optimize the operations support plan, leveraging support team members and Google technologies.
Engage and partner with key Product decision makers to communicate and realize support goals.
Maintain a pulse on user feedback, provide prompt and proper resolution of technical challenges, and provide meaningful feedback to product teams to improve the user experience.","BA/BS degree or equivalent practical experience.
6 years of relevant experience.","MBA or other advanced degree
5 years of experience in Internet products and technologies.
Experience in providing excellent communication both cross-functionally and to all levels of stakeholders.
Ability to work well in a fast paced cross-functional team environment
Ability to work independently on project deliverables in a fast-paced ambiguous environment with proven success in project management, execution and multi-tasking."
470,Google,"Business Intern, Veteran","Seoul, South Korea","Job responsibilities and detailed projects will be determined based on your educational background, interests and skills.","Enrolled in a full time Bachelor's or Master's program graduating before February 2019.
Be able to complete 6 months of internship at Google Seoul office.
Ability to speak and write in English and Korean fluently and idiomatically.
Eligibility as vocation support candidate with a certificate issued by the Korean Ministry of Patriots and Veterans Affairs.","Demonstrated interest in the Internet and in Google’s technology and business.
Excellent project management, interpersonal and organizational skills, with the ability to drive and implement ideas in a challenging environment.
Demonstrated ability to be a self-starter and independent thinker.
Effective analytical skills, with the ability to take on highly strategic and challenging business problems."
471,Google,"Product Analyst, Data Science","Mountain View, CA, United States","Conduct data analysis to make business recommendations (cost-benefit, invest-divest, forecasting, impact analysis).
Deliver effective presentations of findings and recommendations to multiple levels of stakeholders, creating visual displays of quantitative information.
Develop and automate reports, iteratively build and prototype dashboards to provide insights at scale, solving for analytical needs.
Collaborate with cross-functional stakeholders to understand their business needs, formulate and complete end-to-end analysis that includes data gathering, analysis, ongoing scaled deliverables and presentations.
Help Google to focus on key decisions to improve products and services.","BA/BS degree or equivalent practical experience.
3 years of experience working with statistical packages (e.g. R, SAS, Stata, MATLAB, etc.)
Experience with articulating product questions, pulling data from datasets (SQL) and using statistics to arrive at an answer.","BA/BS or Master's degree with emphasis on coursework of a quantitative nature (e.g., Statistics, Computer Science, Engineering, Mathematics, Data Sciences)
Experience in scripting with SQL, extracting large sets of data, and design of ETL flows
Work experience in an inter-disciplinary/cross-functional field.
Deep interest and aptitude in data, metrics, analysis and trends and applied knowledge of measurement, statistics and program evaluation.
Distinctive problem solving skills and impeccable business judgment.
Capable of translating analysis results into business recommendations. Strong written and verbal communication skills."
472,Google,"Product Analytics Lead, Data Science","San Bruno, CA, United States","Conduct data analysis to make business recommendations (cost-benefit, invest-divest, forecasting, impact analysis).
Deliver effective presentations of findings and recommendations to multiple levels of leadership, creating visual displays of quantitative information. Develop and automate reports, iteratively build and prototype dashboards to provide insights at scale, solving for analytical needs.
Collaborate with cross-functional partners to understand their business needs, formulate and complete end-to-end analysis that includes data gathering, analysis, ongoing scaled deliverables and presentations.
Develop a vision and roadmap for analytics across a product or functional group.
Own relationships with executive stakeholders across Google Engineering.","BA/BS degree or equivalent practical experience.
8 years of relevant experience in an analytical function.
Experience working with statistical packages (e.g. R, SAS, Stata, MATLAB, etc.).
Experience with articulating product questions, pulling data from datasets (SQL) and using statistics to arrive at an answer.","BA/BS or Master's degree with emphasis on coursework of a quantitative nature (e.g., Statistics, Computer Science, Engineering, Mathematics, Data Sciences).
Experience in scripting with SQL, extracting large sets of data, and design of ETL flows.
Work experience in an inter-disciplinary/cross-functional field.
Deep interest and aptitude in data, metrics, analysis and trends and applied knowledge of measurement, statistics and program evaluation.
Distinctive problem solving skills and impeccable business judgment.
Capable of translating analysis results into business recommendations. Strong written and verbal communication skills."
473,Google,"Business Strategy Lead, Phones Business","Mountain View, CA, United States","Be responsible for conducting market/competitive/industry analysis to determine where the mobile phone market is currently and where it’s headed.
Analyze data to guide and develop business strategy, develop TAM (Total Addressable Market) models, country deep dives, develop forecasts, develop and maintain mid- to long-term Pixel phone business strategy.
Work with Product Management, Procurement, Finance, Marketing and Sales cross-functionally to enable product decisions on features, pricing, positioning and innovation.","Master's degree or equivalent practical experience.
5 years of experience within the mobile hardware ecosystem.
Experience in one or more of the following disciplines: Strategy & Operations, Business planning and execution in a high-tech, CE/Mobile/Telecoms industry.","Ability to lead and handle multiple time-sensitive projects.
Creative and results driven, the ability to zoom from strategy to execution, business minded and collaborative.
Outstanding analytical skills and strong understanding of statistical modeling techniques.
Superb communication skills, the ability to comfortably interact with both partner’s and Google’s executive management."
474,Google,"Head of Business Development, Strategic Partnerships, Google Cloud","Sunnyvale, CA, United States","Identify/prioritize partner targets and Go-to-Market structures for G Suite and Cloud Platform.
Lead partnerships that result in growth and adoption of G Suite and Google Cloud Platform.
Engage with key C-level and internal stakeholders to create new business structures and growth opportunities.
Develop joint business plans with partners; accountable for hitting key growth metrics.","Bachelor's degree or equivalent practical experience.
7 years of relevant work experience (e.g. in agreement, tech, sales, finance) and/or SaaS industry experience.","MBA, MS or other advanced degree.
Experience in SaaS, cloud platform, telecommunications, and/or IT infrastructure businesses.
Experience building and managing a team, and building key cross-functional relationships (product management, implementation, legal, finance, marketing, etc.).
Strong attention to detail, highly entrepreneurial, creative, open-minded, persistent, highly collaborative and passion for and understanding of Google products
Excellent interpersonal and communication skills to formulate and articulate contractual, technical, financial and value points with partners.
Ability to travel 20%."
475,Google,"Strategy and Operations Manager, Consumer Hardware Products","Mountain View, CA, United States","Help develop an analytics framework, managing in-depth analysis to support and strengthen our product strategy. Provide industry and user insights, a data-driven approach and strategic frameworks leveraging internal and external data.
Lead executive communications across organizations and for external opportunities. Ensure alignment between product strategy, go-to-market strategy, and marketing plans; support development and tracking of OKRs with x-functional and marketing leadership.
Design and build key operational structures and processes to ensure the team works efficiently and as flexibly as possible with cross-functional teams globally.
Manage and represent emerging Hardware through annual and quarterly planning, strategy and execution. Identify and manage ad hoc strategic projects, everything from defining new product strategies to executing initiatives.","Master's degree or equivalent practical experience.
5 years of work experience.","Project management experience.
Strong product knowledge and interest in keeping up with latest relevant technology.
Understanding of statistical modeling techniques.
Ability to lead and handle multiple time-sensitive projects.
Excellent analytical skills.
Excellent communication skills, with the ability to comfortably interact with partners and executive management."
476,Google,"Global Head of Strategy and Operations, Brand Studio","San Francisco, CA, United States","Lead, manage, and represent Brand Studio Marketing via business planning. Lead strategic projects and identify potential topics/themes for exploration and development on a proactive basis with potential to become future investment areas.
Bring even greater rigor to Brand Studio’s ongoing operations; conduct data-driven analysis to support and make recommendations on strategy and investment.
Evaluate and pressure test brand marketing/program performance. Identify opportunities to drive greater engagement and impact across a broad portfolio of programs, and develop data-driven recommendations for the leadership team.
Lead development of communications our priorities, our progress and our results and key insights from across the team within the Brand Studio and to key executive stakeholders across Google.
Manage a small team of Strategy and Operations professionals working across the studio to manage the core financial and operational functions, and reporting into central marketing Strategy and Operations function.","BA/BS degree or equivalent practical experience.
8 years of experience developing strategy for Marketing and/or Management Consulting organizations.","Experience in a role requiring rigorous analytical problem solving, quantitative analysis, and communicating findings to management.
Experience in team management, with the ability to work across teams, build relationships and influence management.
Ability to work through ambiguity in a fast-changing environment, with an entrepreneurial approach.
Excellent written and oral communication and interpersonal skills."
477,Google,"SMB Sales Manager, International, Google Cloud","Dublin, Ireland","Lead a team of managers and their teams to achieve maximum business growth, focusing on people leadership and motivating and enabling the team to be successful.
Develop and implement best practices for your programs and markets, ensuring the team is up to date with the newest trends and pitches. Improve team skills through development and training. Manage the sales operation to operate at scale and provide management support and coaching.
Identify growth projects and programs that can scale the business. Plan and implement programs and work with cross-functional stakeholders in the wider Cloud organization, including Sales, Marketing, Sales Engineering, Product, and Partnerships.
Manage productive relationships with demand management and marketing leaders and representatives as well as our partner ecosystem to drive strategy and execution.
Perform ad-hoc analysis to predict, measure and interpret business trends and inform key decisions. Communicate findings on a regular basis to all levels of management and leverage customer feedback to implement improvements to the content that we share with customers.","BA/BS degree or equivalent practical experience.
Experience leading teams with a focus on coaching and mentoring. People management, organization, and interpersonal experience.
Experience in the technology market and with SaaS and Cloud (IaaS and PaaS) market dynamics globally.
Ability to speak and write in English fluently and idiomatically.","MBA.
Experience managing senior stakeholders in a matrixed organization.
Experience working in a scaled environment in inside-sales, IT sales, marketing or operations.
Proven ability to deliver projects on time and to budget, and ability to effectively operate with enthusiasm and flexibility in a fast-paced, constantly evolving team environment.
Ability to initiate manage multiple complex, cross functional projects with minimal guidance. Ability to translate analysis and insights into actionable business plans.
Demonstrated organizational, problem solving, project management, interpersonal and leadership skills."
478,Google,Global Business Strategy Manager,"Mountain View, CA, United States","Work with the company's senior executive leadership to define, launch, and drive strategic and operational initiatives.
Structure and execute operational and strategic initiatives by developing work plans, gathering and synthesizing relevant data, leading analyses and developing final recommendations.
Lead cross-functional, global teams to achieve business objectives.
Communicate findings to senior management and to the broader organization.
Drive recommendations through to implementation and results.","BA/BS degree or equivalent practical experience
6 years of experience at a management consulting or private equity firm, or equivalent project management experience in a line role for a technology firm.","MBA or graduate degree in a management, technical or engineering field.
8 years of relevant work experience in consulting, software, internet and/or media industries.
Experience leading complex operational and strategic initiatives.
Demonstrated ability to present to executives and communicate with highly technical management team.
Distinctive problem-solving and analysis skills, combined with impeccable business judgment.
Excellent written/verbal communication and interpersonal skills."
479,Google,"Product Analyst, Data Science","Seattle, WA, United States","Conduct data analysis to make business recommendations (cost-benefit, invest-divest, forecasting, impact analysis).
Deliver effective presentations of findings and recommendations to multiple levels of stakeholders, creating visual displays of quantitative information.
Develop and automate reports, iteratively build and prototype dashboards to provide insights at scale, solving for analytical needs.
Collaborate with cross-functional stakeholders to understand their business needs, formulate and complete end-to-end analysis that includes data gathering, analysis, ongoing scaled deliverables and presentations.
Help Google to focus on key decisions to improve products and services.","BA/BS degree or equivalent practical experience.
3 years of experience working with statistical packages (e.g. R, SAS, Stata, MATLAB, etc.)
Experience with articulating product questions, pulling data from datasets (SQL) and using statistics to arrive at an answer.","BA/BS or Master's degree with emphasis on coursework of a quantitative nature (e.g., Statistics, Computer Science, Engineering, Mathematics, Data Sciences)
Experience in scripting with SQL, extracting large sets of data, and design of ETL flows
Work experience in an inter-disciplinary/cross-functional field.
Deep interest and aptitude in data, metrics, analysis and trends and applied knowledge of measurement, statistics and program evaluation.
Distinctive problem solving skills and impeccable business judgment.
Capable of translating analysis results into business recommendations. Strong written and verbal communication skills."
480,Google,"Project Manager (EMEA), Customer Experience, Go-to-Market","Dublin, Ireland","Run listening programs across LCS advertisers, agencies and internal teams to understand the voice of our customers. Lead customer listening initiatives (e.g. Customer listening events, CSAT surveys). Run customer experience workshops to drive action around customer feedback.
Use customer feedback to activate change and improve customer satisfaction. Manage customer first OKRs together with country leadership and Go-to-Market teams.
Define and lead EMEA-wide improvement initiatives to act on customer feedback and deliver improvements to the customer experience, and manage internal partnerships.
Manage country level improvement programs, celebrate success and proactively overcome challenges and roadblocks. Identify and proactively share cluster best practices across EMEA.","BA/BS degree or equivalent practical experience.
Experience working directly with customers, in a B2B organization or in a customer experience environment.","Experience working with quantitative and qualitative research methods.
Effective project management skills, with the ability to operate in a fast-paced organization. Ability to map customer journeys.
Entrepreneurial, with a passion to change the ‘established’ way of doing things.
Strong influencing, interpersonal and networking skills, with the ability to work with both technical and business stakeholders across multiple functions and at multiple levels, as well as with peers.
Excellent problem-solving and analytical skills, with a demonstrated ability to handle complex work."
